[
  {
    "slug": "artform",
    "name": "ArtForm Agency",
    "sources": [
      {
        "type": "ga4",
        "config": {
          "propertyId": "310586485"
        }
      },
      {
        "type": "search-console",
        "config": {
          "siteUrl": "https://artformagency.com/"
        }
      },
      {
        "type": "bing-webmaster",
        "config": {
          "siteUrl": "https://artformagency.com/"
        }
      },
      {
        "type": "pagespeed",
        "config": {
          "url": "https://artformagency.com/",
          "strategy": "mobile"
        }
      },
      {
        "type": "google-ads",
        "config": {
          "customerId": "000-000-0000",
          "currency": "USD"
        },
        "notes": "TODO: real Google Ads customer id needed — placeholder serves demo data."
      },
      {
        "type": "linkedin-ads",
        "config": {
          "accountId": "500000000",
          "currency": "USD"
        },
        "notes": "TODO: placeholder LinkedIn account id — replace with the real sponsored-account id."
      },
      {
        "type": "mailchimp",
        "config": {}
      },
      {
        "type": "hubspot",
        "config": {
          "tokenEnv": "HUBSPOT_TOKEN_ARTFORM"
        }
      }
    ],
    "brand": {
      "primary": "#426fb6",
      "accent": "#e41679"
    },
    "report": {
      "recipients": [
        "reports@artformagency.com"
      ],
      "enabled": false
    }
  },
  {
    "slug": "bbbnp",
    "name": "BBB National Programs",
    "sources": [
      {
        "type": "ga4",
        "config": {
          "propertyId": "302989852"
        }
      },
      {
        "type": "ga4",
        "id": "ga4-cisr",
        "label": "BBBNP CISR/IRI",
        "config": {
          "propertyId": "499713205",
          "aiInsights": false
        },
        "notes": "Secondary property. aiInsights:false so this section doesn't repeat the main property's AI block."
      },
      {
        "type": "search-console",
        "config": {
          "siteUrl": "https://bbbprograms.org/"
        }
      },
      {
        "type": "bing-webmaster",
        "config": {
          "siteUrl": "https://bbbprograms.org/"
        }
      },
      {
        "type": "google-ads",
        "config": {
          "customerId": "000-000-0000",
          "currency": "USD"
        },
        "notes": "TODO: real Google Ads customer id needed — placeholder serves demo data."
      },
      {
        "type": "mailchimp",
        "config": {}
      },
      {
        "type": "hubspot",
        "config": {
          "tokenEnv": "HUBSPOT_TOKEN_BBBNP"
        }
      }
    ],
    "brand": {
      "primary": "#333333",
      "accent": "#426fb6"
    },
    "views": [
      {
        "name": "CISR/IRI",
        "sourceIds": [
          "ga4-cisr"
        ]
      }
    ],
    "notes": "The CISR/IRI GA4 property gets its own named tab via the explicit source id + view."
  },
  {
    "slug": "isea",
    "name": "ISEA",
    "sources": [
      {
        "type": "ga4",
        "config": {
          "propertyId": "333478304"
        }
      },
      {
        "type": "search-console",
        "config": {
          "siteUrl": "https://safetyequipment.org/"
        }
      },
      {
        "type": "bing-webmaster",
        "config": {
          "siteUrl": "https://safetyequipment.org/"
        }
      },
      {
        "type": "linkedin-ads",
        "config": {
          "accountId": "500000001",
          "currency": "USD"
        },
        "notes": "TODO: placeholder LinkedIn account id — replace with the real sponsored-account id."
      },
      {
        "type": "mailchimp",
        "config": {}
      }
    ],
    "brand": {
      "primary": "#426fb6",
      "accent": "#e41679"
    }
  },
  {
    "slug": "maximus",
    "name": "Maximus",
    "sources": [
      {
        "type": "ga4",
        "config": {
          "propertyId": "302350399",
          "geoScope": "us"
        }
      },
      {
        "type": "search-console",
        "config": {
          "siteUrl": "https://maximus.com/"
        }
      },
      {
        "type": "bing-webmaster",
        "config": {
          "siteUrl": "https://maximus.com/"
        }
      },
      {
        "type": "linkedin-ads",
        "config": {
          "accountId": "511334398",
          "currency": "USD"
        }
      },
      {
        "type": "google-ads",
        "config": {
          "customerId": "000-000-0000",
          "currency": "USD"
        },
        "notes": "TODO: real Google Ads customer id needed — placeholder serves demo data."
      },
      {
        "type": "hubspot",
        "config": {
          "tokenEnv": "HUBSPOT_TOKEN_MAXIMUS"
        }
      },
      {
        "type": "ga4",
        "id": "ga4-ccc",
        "label": "CCC — Web",
        "config": {
          "propertyId": "302350399",
          "geoScope": "us",
          "pageTitleContains": "Omnichannel Contact Center",
          "aiInsights": false
        },
        "notes": "Scoped by page title, not URL path — no exact path was available for CCC. Matches the 'Omnichannel Contact Center' title variants."
      },
      {
        "type": "google-ads",
        "id": "google-ads-ccc",
        "label": "CCC — Google Ads",
        "config": {
          "customerId": "000-000-0000",
          "currency": "USD",
          "hideSpend": true
        },
        "notes": "TODO: CCC Google Ads campaign name not confirmed — currently unscoped (shows the whole account)."
      },
      {
        "type": "linkedin-ads",
        "id": "linkedin-ads-ccc",
        "label": "CCC — LinkedIn",
        "config": {
          "accountId": "511334398",
          "currency": "USD",
          "campaignIds": [],
          "hideSpend": true
        },
        "notes": "TODO: CCC LinkedIn campaign ids not confirmed — currently unscoped."
      },
      {
        "type": "microsoft-ads",
        "id": "microsoft-ads-ccc",
        "label": "CCC — Microsoft Ads",
        "config": {
          "accountId": "000000000",
          "currency": "USD",
          "campaignFilter": "CCC",
          "hideSpend": true
        },
        "notes": "TODO: real Microsoft Ads account id needed — placeholder serves demo data."
      },
      {
        "type": "ga4",
        "id": "ga4-census",
        "label": "Census — Web",
        "config": {
          "propertyId": "302350399",
          "geoScope": "us",
          "pagePathPrefix": "/federal-government/civilian/census-support-services",
          "aiInsights": false
        }
      },
      {
        "type": "google-ads",
        "id": "google-ads-census",
        "label": "Census — Google Ads",
        "config": {
          "customerId": "000-000-0000",
          "currency": "USD",
          "campaignNameFilter": "Big Brand Innovation Search",
          "hideSpend": true
        },
        "notes": "'Big Brand Innovation Search' is broader than a purely Census-named campaign — confirm with the media team that it remains the intended Google proxy for Census."
      },
      {
        "type": "linkedin-ads",
        "id": "linkedin-ads-census",
        "label": "Census — LinkedIn",
        "config": {
          "accountId": "511334398",
          "currency": "USD",
          "campaignIds": [],
          "hideSpend": true
        },
        "notes": "TODO: numeric campaign ids from LinkedIn Campaign Manager needed to scope this view."
      },
      {
        "type": "microsoft-ads",
        "id": "microsoft-ads-census",
        "label": "Census — Microsoft Ads",
        "config": {
          "accountId": "000000000",
          "currency": "USD",
          "campaignFilter": "Census",
          "hideSpend": true
        },
        "notes": "TODO: real Microsoft Ads account id needed — placeholder serves demo data."
      },
      {
        "type": "ga4",
        "id": "ga4-defense",
        "label": "Defense — Web",
        "config": {
          "propertyId": "302350399",
          "geoScope": "us",
          "pagePathPrefix": "/federal-government/fed-defense",
          "aiInsights": false
        }
      },
      {
        "type": "google-ads",
        "id": "google-ads-defense",
        "label": "Defense — Google Ads",
        "config": {
          "customerId": "000-000-0000",
          "currency": "USD",
          "campaignNameFilter": [
            "Big Brand Innovation Search",
            "DoD"
          ],
          "hideSpend": true
        },
        "notes": "TODO: real Google Ads customer id needed — placeholder serves demo data."
      },
      {
        "type": "linkedin-ads",
        "id": "linkedin-ads-defense",
        "label": "Defense — LinkedIn",
        "config": {
          "accountId": "511334398",
          "currency": "USD",
          "campaignIds": [],
          "hideSpend": true
        },
        "notes": "TODO: numeric campaign ids from LinkedIn Campaign Manager needed to scope this view."
      },
      {
        "type": "microsoft-ads",
        "id": "microsoft-ads-defense",
        "label": "Defense — Microsoft Ads",
        "config": {
          "accountId": "000000000",
          "currency": "USD",
          "campaignFilter": "DoD",
          "hideSpend": true
        },
        "notes": "TODO: real Microsoft Ads account id needed — placeholder serves demo data."
      },
      {
        "type": "ga4",
        "id": "ga4-national-security",
        "label": "National Security — Web",
        "config": {
          "propertyId": "302350399",
          "geoScope": "us",
          "pagePathPrefix": "/federal-government/civilian/national-security-services",
          "aiInsights": false
        }
      },
      {
        "type": "google-ads",
        "id": "google-ads-national-security",
        "label": "National Security — Google Ads",
        "config": {
          "customerId": "000-000-0000",
          "currency": "USD",
          "campaignNameFilter": [
            "DHS/National Security Search Ads",